{"$schema":"https://json-schema.org/draft/2020-12/schema","type":"object","additionalProperties":false,"required":["receipt_id","seed_id","conditions","nontriviality_preview","disposition","next_permitted_action"],"properties":{"receipt_id":{"const":"system-one-seed-pre-admission-3"},"seed_id":{"const":"seed-virus-persistence-block-generalization"},"conditions":{"type":"array","minItems":7,"maxItems":7,"items":{"type":"object","additionalProperties":false,"required":["condition_id","status","evidence"],"properties":{"condition_id":{"enum":["bounded-claim","raw-content","reproducible-baseline","named-boundary","independent-structure","meaningful-consequences","self-contained-interpretation"]},"status":{"const":"pass"},"evidence":{"type":"string","minLength":30}}}},"nontriviality_preview":{"type":"object","additionalProperties":false,"required":["status","evidence"],"properties":{"status":{"const":"pass"},"evidence":{"type":"string","minLength":50}}},"disposition":{"const":"pre-admitted-seed"},"next_permitted_action":{"type":"string","minLength":40}}}
