{"receipt_id":"system-one-seed-pre-admission-3","seed_id":"seed-virus-persistence-block-generalization","conditions":[{"condition_id":"bounded-claim","status":"pass","evidence":"The PLOS Biology abstract claims that early epidemiological characteristics are associated with population-level virus persistence."},{"condition_id":"raw-content","status":"pass","evidence":"Official Zenodo spill.char.dataset1.csv downloaded with MD5 79b31f98f923c18a3c965a72166de8d3."},{"condition_id":"reproducible-baseline","status":"pass","evidence":"Official PredictingPersistenceCorrelativeModels.R downloaded with MD5 9f7a50e78c4dc6450ddd739334cc6513 and fits the reported associations."},{"condition_id":"named-boundary","status":"pass","evidence":"The article states that the measured characteristics may change across passages and that remaining strain and line effects are not fully captured."},{"condition_id":"independent-structure","status":"pass","evidence":"Strainsandblocks.csv identifies repeated host strains across experimental blocks, permitting a block-held-out check."},{"condition_id":"meaningful-consequences","status":"pass","evidence":"Held-block predictions can support, attenuate, or contradict the bounded association claim."},{"condition_id":"self-contained-interpretation","status":"pass","evidence":"The paper, raw data, block table, and R code identify the outcome, predictors, random effects, and a narrow predictive check."}],"nontriviality_preview":{"status":"pass","evidence":"The checked correlative script fits pooled models with block and strain random effects; no leave-one-block-out prediction or block-level transfer result was located."},"disposition":"pre-admitted-seed","next_permitted_action":"Run one source-and-fragility audit for this seed only; preserve the preceding two screening rejections and do not promote to System 2."}
